MessageID,MessageType,MessageBody,Timestamp
"1336","sent","hes working on something maybe, i never know what that kid is up to","1328771574"
"546","sent","i was sittin with  strep all weekend","1322367930"
"2936","sent","Bring it by and I'll write it in there lol","1379995071"
"120","sent","ahahah","1312951613"
"1927","recieved","we shall see","1335195703"
"2488","sent","before i do anything rash","1358925094"
"1121","sent","racks on racks on stacks","1327281866"
"1422","recieved","forsure","1329104457"
"548","sent","yeah, i thought it was mono, that would suck","1322367950"
"1992","sent","this is me","1336132565"
"3058","recieved","yo maciek","1380083404"
"121","recieved","not in a ill see you in two weeks and see you in four. i mean i will see you in two weeks.","1312951615"
"1122","recieved","exactly.","1327281955"
"1337","recieved","ah ight","1328771629"
"2937","recieved","i'm already gone :/","1379995103"
"549","sent","im free wednesday night onward, if anything","1322367961"
"2489","recieved","no man rash is never the answer","1358925112"
"1928","recieved","i'm just happy to have destroyed the average.","1335195711"
"1423","recieved","almost done with 210 hmew","1329106586"
"3059","sent","Yoyo","1380083454"
"1123","recieved","just gonna get all my groups of friends together. ","1327281984"
"1993","recieved","so im not too worried","1336132566"
"1929","sent","fshoo","1335195892"
"2938","sent","sheeit","1379995113"
"550","recieved","same here","1322367968"
"1338","recieved","waddddup","1329071319"
"3060","recieved","if you were to brush up on algorithms for interviews, where would you go?","1380083524"
"1339","sent","nm chillin","1329071717"
"122","recieved","and we *_WILL_* be drunk in two weeks togethaer","1312951624"
"2490","recieved","real men are calm and calculated","1358925119"
"1930","sent","i gtg to class peaces","1335195897"
"1124","sent","lol, i find that destructive, but do it","1327281996"
"2939","sent","dude, pure js sucks fat ones","1379995119"
"1994","sent","http://i.imgur.com/3eQEL.jpg","1336132567"
"2491","recieved","think it out, you know her best","1358925132"
"551","sent","just one mp and one exam, the way a week should be","1322367971"
"3061","sent","Cracking the coding interview 4th edition","1380083568"
"1340","sent","hbu?","1329071718"
"1995","sent","you're swaggin hard as hell lol","1336132576"
"1425","recieved","then gonna do prelab... sorry im movin slow...","1329106594"
"1931","recieved","pce","1335195903"
"1125","sent","if you become a pike by then theyll be fuckin w/ you too lol","1327282004"
"1424","recieved","hmw*","1329106588"
"2940","sent","jquery all the way","1379995124"
"552","recieved","physnuts?","1322367972"
"124","sent","first polish club party is the first friday after quad day, i expect you will be attending!","1312951643"
"123","sent","yes!","1312951630"
"2492","sent","yeah man. it's just hard when i can't get her to talk to me you know? w/e just gotta wait it out a little, give her space for another week","1358925283"
"1996","recieved","hahaha","1336132578"
"1594","recieved","can u come to HAB? i get out at 9:50","1329799475"
"210","recieved","shes like my best friend at school","1313515417"
"1062","sent","u added her on facebook?","1327116271"
"1169","recieved","what time u free?","1328032494"
"333","recieved","im thinking kamikazes and white russians haha","1314316242"
"2128","sent","https://fbcdn-sphotos-a.akamaihd.net/hphotos-ak-snc6/181845_10150814885592466_523432465_9844183_156823218_n.jpg","1337731083"
"2941","sent","or angular","1379995125"
"211","recieved","we don't touch each other","1313515421"
"61","sent","hows your summer been?","1311047627"
"1997","recieved","yeah idk","1336132584"
"1595","sent","meet me at the corner and you got it buddy","1329799509"
"2493","sent","she still texts me and shit so it's not like she's totally avoiding me","1358925297"
"1170","sent","i got 290 and 173 due too, ill have my hands full","1328032498"
"1063","sent","okay","1327116272"
"2942","recieved","lol","1379995139"
"62","recieved","its been good man. very ready to be back on campus","1311047672"
"2129","sent","get someeeee","1337731084"
"334","recieved","yo dude. nice seein you last night haha","1314384971"
"2494","recieved","yo, maybe if you think she's depressed, it's the counseling center","1358925393"
"1596","sent","just holler at me at like 10 mins before your class is done","1329799538"
"1998","recieved","have you heard what the curves like at the end of the class?","1336132594"
"1171","sent","i end class at like 6","1328032502"
"335","recieved","u goin home this weekend?","1314757628"
"2943","recieved","idk imma try and use that function","1379995144"
"1064","recieved","nah, but i found her","1327116284"
"2130","sent","brb goin to champaign","1337731088"
"212","sent","lmaoooooo i gotcha","1313515446"
"1597","recieved","forsure.","1329799570"
"1999","sent","lol, i know there has to be one","1336132605"
"2495","recieved","for her","1358925397"
"213","recieved","whens the first polish party btw?","1313515463"
"1172","sent","then grainger deanger","1328032512"
"336","sent","naw niggy","1314758187"
"2944","recieved","anyway you can read it?","1379995147"
"2000","sent","hopefully i pass, if not im retaking this bitch next semester","1336132613"
"1065","sent","thats the way to do it","1327116292"
"2131","recieved","ight.","1337731104"
"64","sent","haha, i feel you","1311047786"
"63","recieved","nothing like being at the uiuc","1311047679"
"2496","recieved","like look man","1358925403"
"1598","recieved","btw how do u say f u in polish?","1329803076"
"1173","recieved","wanna do 173 and 210 at 6?","1328032514"
"2001","sent","but its w/e","1336132615"
"337","sent","im playin catch up lol","1314758190"
"2132","recieved","yo man","1338524851"
"2497","recieved","sometimes it's easier to talk to someone you don't know about stuff and it's best if it's someone who's a professional and cares enough to make their career listening to people","1358925432"
"1066","recieved","http://profile.ak.fbcdn.net/hprofile-ak-snc4/372603_699488040_1764090116_n.jpg","1327116297"
"2945","sent","dude, there's no point in reinventing the weel","1379995175"
"214","sent","umm, well we party every day","1313515471"
"338","recieved","Haha we partying?","1314758206"
"1599","sent","like, somewhat politely or very vulgurly","1329803137"
"1174","sent","thats the plan","1328032525"
"215","recieved","ill bring her around she's half polish haha","1313515474"
"2002","sent","i'm planning on switching to cs","1336132624"
"66","recieved","lol motivated to do well in school?","1311047831"
"2133","recieved","i'm so fucking happy","1338524854"
"1067","recieved","shes the one on the right","1327116300"
"2946","sent","add a query dependency, and rock it","1379995187"
"65","sent","im ready to quit my shitty job and end my shitty community college carreer haha","1311047805"
"2498","recieved","trust me, it helped me.","1358925437"
"1600","recieved","haha very vulgarly","1329803214"
"1175","sent","im gonna knock out 290 now","1328032534"
"339","sent","lol, i dont see why not","1314758232"
"2003","recieved","damn, idk, i think i really can't get lower than a B in this class unless I BOMB the final","1336132638"
"216","sent","but probably friday at the polish headquarters","1313515478"
"1601","recieved","in case i get mad at a polish person again...","1329803222"
"1068","sent","i was worried it would be the one on the left","1327116317"
"2134","sent","haha whats good man?","1338524914"
"2499","sent","yeah, she's told me she went to the mental health center once before, but it was quick and  in passing","1358925466"
"2947","sent","jquery**","1379995194"
"340","sent","im not goin out every day though","1314758236"
"2004","recieved","damn dude, don't do that","1336132642"
"67","sent","hahahha quite","1311047853"
"2135","recieved","remember that girl i'm into who's got a guy?","1338524922"
"1176","recieved","ah ight. you know anyone we can bring with who took 290 last semester?","1328032552"
"2500","sent","her mom's a psychologist, so she's probably fed up with bullshit like that lol","1358925480"
"2948","sent","these tables have way more functionality than you can reasonably code in a whole day","1379995218"
"341","recieved","Saturday night let's party. But text me ur response. Gettin off fb.","1314758261"
"217","sent","lol thats cool, bring whoever","1313515490"
"2005","sent","man, i've been giving it a lot of thought, i'm gonna see if i can finish in 4 years by tinkering with shit over the summer","1336132671"
"1602","recieved","173 all night O_O","1329973333"
"69","recieved","haha i didnt come off so hot but im still in a good spot","1311047913"
"2136","sent","yeeeeeeeeeeeeeee the filipina?","1338524932"
"1177","recieved","210*","1328032556"
"1070","sent","hit that shit again!","1327116329"
"2949","sent","what're you using to format the site? just pure html/js?","1379995269"
"1603","sent","lol, puttin in work at grainger","1329973436"
"2501","recieved","haha i could see that","1358925515"
"68","sent","i pulled off a 3.5 miraculously, im quite satisfied with last school year","1311047870"
"2006","sent","i'll take 391 with you still though :)","1336132685"
"1069","sent","the one on the right is solid as hell wtf","1327116324"
"1604","sent","this stuffs easy peasy","1329973439"
"1178","sent","im thinking d ras or alex buris will be in the vicinity","1328032601"
"70","sent"," naw, youll be good","1311048028"
"2137","recieved","ye","1338524936"
"219","sent","no, next friday","1313515499"
"2950","sent","/css","1379995276"
"342","sent","kk ttyl","1314758288"
"2502","recieved","it's always worth a shot tho.","1358925521"
"2007","recieved","haha forsure man","1336132699"
"1071","recieved","lol shes a half polski too","1327116340"
"343","recieved","yo man u got plans for tonight?","1315104225"
"220","sent","lol","1313515500"
"1179","recieved","is that like a forsure or no?","1328032632"
"1605","recieved","It's not bad it's just memorizing everything","1329973650"
"218","recieved","i wont be there yet this friday","1313515491"
"71","sent","as long as you dont spend too much time in my apt drinking the days away","1311048048"
"2138","recieved","not anymore! haha","1338524940"
"2008","recieved","i really wish they'd tell us where we're at with our grades tho...","1336132723"
"2951","recieved","html / css","1379995301"
"1606","sent","yeeee","1329974139"
"1180","recieved","or ur just assuming","1328032641"
"2503","recieved","i mean. have i ever told you about my issues n shit?","1358925530"
"221","recieved","ohhh shyyt. well ill be there","1313515506"
"2139","sent","nice bro!","1338524976"
"344","recieved","hey man do u still have my tshirt?","1315454630"
"72","sent","lol","1311048049"
"2009","recieved","i hate thinking about it","1336132727"
"2952","recieved","i've never really used js","1379995306"
"1607","recieved","And I think I kinda do like sam haha. I thought about it for a bit today","1329974170"
"1181","sent","im just assuming","1328032744"
"1072","sent","theres only one better kind of polski, a full polski","1327116361"
"222","sent","lol of cours","1313515512"
"2140","sent","shes on campus here w/ you right?","1338524981"
"1073","sent","lol","1327116362"
"2953","recieved","dunno why","1379995308"
"73","recieved","ahaha or you in mine man","1311048082"
"2010","sent","lol, i dont think about it ever, too much stress associated","1336132752"
"2505","sent","yeah man, you told me all about em once","1358925546"
"345","sent","lol, why yes i do","1315454655"
"1182","sent","those kids are always workin","1328032748"
"2504","recieved","i trust you so i don't really have a problem tellin you","1358925536"
"1608","sent","lol good shit man. im workin a couple ladies myself","1329974205"
"223","sent","e","1313515513"
"1074","recieved","haha this is true","1327116368"
"2954","sent","bro bro hit up bootstrap","1379995311"
"346","sent","come by whenever to pick it up","1315454661"
"2141","recieved","yeup","1338525001"
"74","recieved","you're welcome any time","1311048086"
"2011","sent","gl, i'll see you at greg!","1336132757"
"1183","recieved","ah ight.","1328032791"
"2506","sent","beginning of sophomore year i think?","1358925552"
"347","recieved","haha ight. i gotta get that soon","1315454700"
"1609","recieved","Do u think sams the settling type tho?","1329974236"
"1075","recieved","idk, i was still drunk when i left her place at 7...","1327116379"
"224","recieved","thats what i like about you guys though","1313515517"
"2142","sent","nice nice nice","1338525050"
"2507","sent","i know shit's hard man","1358925564"
"348","recieved","yo dude","1316819658"
"2012","recieved","im already here haha","1336132762"
"1184","recieved","well let's hope so because i need to knock these out quick","1328032800"
"1610","sent","man, idk if sam even likes boys","1329974312"
"2955","sent","http://getbootstrap.com/2.3.2/","1379995325"
"225","recieved","not shit like other cultural groups, like if you're not mexican, its friggin awkward if i bring friends","1313515533"
"2143","sent","things are lookin god man haha","1338525058"
"76","sent","i think we'll be in for a good year","1311048126"
"1185","recieved","no sleep last night","1328032802"
"2508","sent","i'm just scared of alcoholism","1358925574"
"2013","recieved","peace man, best of luck","1336132765"
"1077","sent","i estimate you were at .20 when you woke up","1327116405"
"349","sent","yo wattup playboy","1316819762"
"2956","sent","it'll easily format your site for mobile too +1","1379995334"
"1611","sent","half her friends are gay","1329974317"
"75","sent","haha, likewise my friend","1311048106"
"2144","sent","im happy for you","1338525064"
"226","recieved","not pointing fingers, but eff that","1313515542"
"350","recieved","nmu?","1316819769"
"1076","sent","lol","1327116389"
"2509","sent","cuz before i met iga, i'm pretty sure i had a problem","1358925586"
"2014","sent","lol brt then!","1336132768"
"77","recieved","forsure man","1311048174"
"1612","recieved","LOL. Should I find out? Haha","1329974343"
"2957","sent","shit i feel like i'm throwing too much shit out there at once","1379995391"
"1078","recieved","and i left my watch there so we're supposed to hang out","1327116410"
"2015","sent","lolz tnx, you too","1336132772"
"227","sent","lol, polish hospitality","1313515552"
"2145","recieved","sup dude","1339196171"
"1187","sent","i slept though 210 im gonna skip 173","1328032910"
"78","recieved","first week back, probably first night i'm back i'll have a pregame","1311048184"
"351","sent","in dcl helpin my buddy w/ his 190 lab lol","1316819771"
"2958","recieved","that's the problem it is overwhelming","1379995434"
"2510","recieved","nah man.","1358925599"
"1613","sent","nah i seen her get on dudes dont worry lol","1329974368"
"1186","sent","damn, go sleep now","1328032903"
"1079","sent","i have a breathalyzer now im a fuckin pro","1327116411"
"2016","recieved","you're not in grainger are you?","1336155190"
"2146","recieved","sorry i couldn't go to your bar crawl the other day","1339196178"
"2959","recieved","i should have you re-do the front end of my site :D","1379995442"
"228","recieved","mexicans are supposed to be the same way","1313515561"
"1188","sent","too lol","1328032912"
"2511","recieved","it was iga. i know that sounds mean, it was just school party life","1358925608"
"352","recieved","haha eaasy stuff","1316819780"
"1614","recieved","Idk. I convinced myself she's worth it. She's nice and cute. But I'm trying to convince myself she's not haha","1329974424"
"80","recieved","to hit the bars man","1311048311"
"2017","recieved","happy birthday my man!","1336233945"
"2960","recieved","lol you like $_$?","1379995446"
"2147","recieved","oi","1339720346"
"1080","recieved","seriously?","1327116420"
"2512","recieved","if you're keeping it in check now it's because you're growing up","1358925615"
"1189","recieved","...","1328032937"
"1615","sent","lol man. thats some existensial shit","1329974573"
"229","sent","who do you think housed all the gypsys and jews in europe? we really dont care","1313515564"
"81","sent","i hope that pregame lasts at least 4 weeks","1311048312"
"2018","sent","lolz, tnx niggy!","1336233990"
"353","recieved","we gotta chill soon btw","1316819827"
"79","sent","pregame?","1311048303"
"1081","recieved","i wanna try it haha","1327116424"
"2148","recieved","i haven't heard from you","1339720349"
"2513","recieved","now, if it starts happening again as you get older, then stay aware","1358925625"
"2961","sent","lol that i do","1379995455"
"1616","recieved","Just typical Mexican shit","1329974616"
"3174","sent","and then the sde/sdet will be your bitches","1381356050"
"230","recieved","only a bunch of prics at school tho","1313515568"
"3062","recieved","what if your interview is tomorrow morning","1380083578"
"125","sent","at the new polish headquarters!","1312951649"
"354","sent","man u goin dayglow?","1316819877"
"82","sent","lol","1311048313"
"1190","recieved","lazy ass","1328032939"
"787","sent","yeah, im gettin to that","1323760169"
"2149","sent","likewise sir","1339720371"
"2256","sent","i decided to finally check my school email yesterday, and my grades, and switch my major","1343186413"
"314","sent","d ras?","1314133642"
"553","sent","yeah physics","1322367987"
"1426","sent","its cool","1329106914"
"3175","recieved","lol","1381356221"
"126","recieved","an honorary pollock would never miss it!","1312951658"
"3063","sent","What language","1380083732"
"83","sent","oh hell yeah haha","1311048318"
"2150","sent","ive been home/working all the time","1339720379"
"788","sent","its just a lot of shit to review, is all","1323760176"
"2257","sent","and all of this shit just piled up for me to do","1343186421"
"1427","sent","i havnt touched 210 yet cuz im working on reading this bullshit","1329106926"
"356","sent","damn nigguh","1316819896"
"3176","recieved","you're goin back full time right?","1381356226"
"554","sent","im not worried though","1322367991"
"3064","recieved","no language","1380083738"
"315","recieved","nah. who's d ras? haha","1314133664"
"789","recieved","exactlyh","1323760202"
"2151","sent","going home this weekend too lol","1339720432"
"84","recieved","ahaha not 19 yet?","1311048319"
"355","recieved","nah man. i sold my ticket","1316819884"
"555","sent","i just suck at geometry","1322367997"
"1428","recieved","where u gonna be just so i know btw","1329106928"
"2258","sent","but i gotta take advantage of every opportunity lolz","1343186433"
"790","recieved","u takin it wednesday or thursday?","1323760208"
"3177","recieved","and any idea who bren baxter is?","1381356417"
"316","recieved","sam harasim lol","1314133669"
"128","sent","yeah, two apts","1312951668"
"357","sent","u gonna miss out!","1316819899"
"3065","recieved","""On the other hand, the Structured Finance group doesn't do strict stochastic calculus in a theoretical sense, but the models are often stochastic in nature.  That is, there is no simulation but the assumptions rely on expectations.  For the most part, what ends up happening is someone asks a question and you try to answer it with quantitative analysis.As far as preparations go, I'd say just brush up on algorithms, math, and stat.  Those are the only technical things I got tested on.  Also, it's best to come up with a good reason as to why you want to work there (they usually grill you on that).""","1380083755"
"2152","recieved","damn dude","1339720438"
"556","recieved","i am a bit haha","1322367998"
"127","recieved","lol your place?","1312951663"
"1429","sent","basement","1329106933"
"2259","sent","hows youre stuff goin?","1343186438"
"85","sent","i turned 19 duriing finals week","1311048332"
"3066","recieved","does that mean anything to you?","1380083758"
"3178","sent","Idk yet,  interviewing with yahoo","1381359330"
"791","sent","wednesday","1323760272"
"129","sent","megaparty, lol","1312951674"
"358","recieved","thats alright","1316819921"
"1430","recieved","ight","1329107141"
"317","sent","oh nice, bring her by","1314133689"
"2153","recieved","supp","1340054138"
"557","sent","nah wth","1322368004"
"2260","recieved","it's good man","1343186441"
"86","sent","i bittersweet moment, but a monumental moment nonetheless","1311048343"
"3067","sent","Math and stat?","1380083945"
"3179","sent","And no idea","1381359341"
"792","sent","hbu?","1323760277"
"359","recieved","lets go out sometime next weekend tho","1316819926"
"130","recieved","oh yeah","1312951674"
"1431","recieved","yo u still there?","1329108947"
"318","recieved","ill shoot her a text","1314133702"
"2154","sent","lol nm niggy chillin","1340054148"
"793","recieved","thursday","1323760282"
"87","recieved","haha forsure","1311048388"
"3068","sent","Sounds like 357","1380083951"
"3180","recieved","We're you a dev at Microsoft?","1381359925"
"558","sent","my ta is hosting an extra study session tuesday night","1322368012"
"360","recieved","maybe thursday night?","1316819946"
"2261","recieved","just takin care of business as usual","1343186453"
"88","sent","alright niggy, time for hotdogs","1311048401"
"319","recieved","that way i wont show up alone haha","1314133707"
"2155","sent","hbu?","1340054150"
"794","recieved","wanna study tmrw man? i know ur real good at that ish","1323760290"
"3069","sent","But I can't be sure","1380083959"
"131","recieved","foooshooo","1312951677"
"320","sent","fshooooo","1314133716"
"2262","recieved","still workin on my business n shit","1343186464"
"1432","recieved","210 yeeeaaaaahhhh","1329191407"
"3181","sent","No I was a service engineer","1381360411"
"361","sent","yeah nigguh im down","1316819985"
"559","sent","hes doing physics education research, so this is like, his shit","1322368020"
"795","sent","you took the conflict for that extra day? lol","1323760296"
"3070","recieved","cs?","1380083973"
"132","sent","possibly 3 apartsments, we will see","1312951682"
"321","recieved","i shot her a text. figure its worth a shot","1314133779"
"2156","recieved","workin man","1340054154"
"3182","recieved","Is that what you got full time","1381361163"
"2263","sent","thats good stuff man","1343186519"
"3071","sent","I mean,  stat algorithms","1380083995"
"561","recieved","nice nice","1322368026"
"1433","sent","stfu uggggggghhhhhhhhh","1329191421"
"560","sent","you want me to forward you the email?","1322368026"
"2157","recieved","from home which is chillll","1340054158"
"3183","recieved","And what do you get promoted to after PM? Sorry, salary hunting","1381363346"
"322","sent","yeah of course","1314133797"
"363","recieved","will do","1316820045"
"2264","sent","so you switched to EE?","1343186522"
"796","sent","yeah nigguh ill be in grainger helping my dumb ass roommate","1323760305"
"797","recieved","hell yeah man. ","1323760306"
"3072","recieved","http://courses.engr.illinois.edu/cs357/","1380084016"
"1434","recieved","loll","1329191457"
"562","sent","the dude has taught me everything","1322368033"
"89","sent","ill talk to you soon though!","1311048407"
"135","sent","alright, imma grab a shower","1312951688"
"2158","sent","oh nice nice","1340054164"
"1435","recieved","im at my place. goin over to grainge soon","1329191473"
"383","sent","we selling at the union this week","1317096007"
"3184","sent","lol no idea mayne","1381379952"
"362","sent","gimmie call","1316819988"
"2265","recieved","yeah, finally figured i should do it","1343186542"
"91","recieved","forsure dude","1311048434"
"798","recieved","shit man, ill be the biggest dumbass in all the land, trust me","1323760329"
"3073","recieved","that class right?","1380084018"
"364","recieved","yo dude","1317095326"
"2159","sent","i just got back from work, i took off early lol","1340054178"
"90","sent","see you soon*","1311048426"
"133","sent","lol","1312951685"
"136","recieved","like triple forsure","1312951690"
"563","recieved","yeah im down","1322368111"
"134","recieved","count me in forsure","1312951686"
"3185","recieved","I'm so drunk","1381379972"
"2266","recieved","research being EE n all","1343186555"
"384","recieved","hook a niggy up. im broke haha","1317096021"
"3074","sent","  idk mayne","1380084567"
"1436","sent","samesies","1329191512"
"2160","recieved","haha nice nice","1340054184"
"799","sent","lol, i know for a fact your grade is better than my roommate's","1323760360"
"137","sent","peaceeee","1312951690"
"365","sent","wattup nig!","1317095768"
"92","recieved","peace man take care","1311048438"
"564","sent","already sent it out","1322368118"
"3186","sent","i'm so sick fml missing 2 exams","1381380009"
"2267","sent","yeah man i feel you","1343186606"
"800","sent","i dont get reception in that dungeon lookin place, but ill be in the basement of the grainger library w/ the linux pcs","1323760378"
"1437","recieved","where u at","1329193753"
"3075","sent","sounds like they want statistical algorithms","1380084574"
"565","sent","hes literally, the shit","1322368126"
"366","recieved","when we partyin this weeek?","1317095778"
"385","sent","lol","1317096029"
"2161","recieved","how's that goin?","1340054196"
"386","sent","u have no idea how many people have asked me to do that","1317096037"
"3187","recieved","dude i'm really lookin forward to my microsoft interview","1381531074"
"1438","recieved","im still not sure if imma do friday","1329196078"
"94","recieved","yo maciek","1312951377"
"367","sent","lol not this week","1317095822"
"2268","sent","brunet was tellin me, in the long run your major doesnt matter. it's what youre doin an that youre happy.","1343186629"
"801","recieved","forsure?","1323760425"
"3076","sent","like covariance and bullshit","1380084580"
"139","recieved","sup dude","1313126227"
"93","sent","you too, peacee","1311048446"
"138","recieved","ight dude. peace.","1312951693"
"2162","sent","its goin good, i'm just working on congregating a bunch of data, sqlite shit","1340054223"
"3188","sent","Hahah goof shit nigguh","1381531139"
"368","sent","parents visiting me this weekend","1317095827"
